Course Code,Course Name,Course Description,Prerequisite,Corequisite,Equivalents,DATA,CHEM,MATH,ENGL,PHYS,COSC,STAT,PHIL,APSC,PSYO,ECON,BIOL,Year 1,Year 2,Year 3,Year 4,Grad
STAT 403,Stochastic Processes,"Stat 403 (3) Stochastic Processes Random walks, Markov chains, Poisson processes, continuous time Markov chains, birth and death processes, exponential models, and applications of Markov chains. [3-0-0] Prerequisite: STAT 303. Learning Outcomes: After completing this course, you will be able to: Understand and describe stochastic processes mathematically as both 1. a collection of time-indexed random variables on a common sample space, and 2. a random trajectory, or sample path, through a given state space. Understand the notion of an i.i.d. (independent and identically distributed) sequence of random variables. Study certain processes associated to i.i.d. sequences, such as record values for non-negative random variables, and runs of 1s for Bernoulli random variables. Construct a random walk from an i.i.d. sequence of real-valued random variables. Define Markov chains in discrete time using transition probabilities, and in continuous time using transition rates.  Construct a Markov chain model, based on a given description.  Verify the Markov property for a given process. Compute the probability distribution for the location of a Markov chain at a given fixed time, using the Chapman-Kolmogorov (discrete time) or forward/ backward Kolmogorov (continuous-time) equations. Define stopping times and understand the strong Markov property. Determine the communicating classes of a Markov chain from its transition probabilities/rates and use these to describe its long-term behaviour. Understand the phenomenon of periodicity in a discrete time Markov chain. Use conditioning and first-step analysis to obtain and solve sets of equations describing important objects associated to Markov chains, such as the hitting probability and expected hitting time of a set, and stationary distributions, when they exist. Understand the notions of recurrence and transience of a stochastic process. Determine the recurrence or transience of various random walks.  Construct and analyze various models in discrete and/or continuous time and study their characteristic properties, such as: branching processes and their survival probability and asymptotic rate of growth, 2. the radioactive decay model, and the time until complete decay, 3. the ehrenfest urn model and its stationary distribution, 4. queuing models, existence or non-existence of a stationary distribution and expected wait times, 5. general birth and death processes, probability of divergence, hitting times and stationary distributions, 6. the basic insurance model and the ruin probability, 7. the Moran model of population genetics, and its probability of fixation and expected time until fixation, 8. the stochastic SIR model of infection spread in a finite population, and its final size.  Understand the connection between discrete time and continuous time Markov chains obtained by the embedded Markov chain. Construct a Markov chain mathematically: 1. from an i.i.d. collection of uniform random variables, in discrete time, and 2. from an i.i.d. collection of exponential random variables, and an i.i.d. collection of uniform random variables, in continuous time. • Use the technique of coupling to study the convergence of a Markov chain to its stationary distribution, when one exists. Construct and analyze the Poisson point process and the corresponding counting process, the Poisson process. Understand its relationship with exponential random variables and with i.i.d. uniform random variables.",STAT 303,,,0,0,0,0,0,0,1,0,0,0,0,0,0,0,0,1,0
STAT 406,Environmetrics,"Foundation of the use of statistical concepts and methods in environmental science and management. Scientific problem-solving using statistical methods. Integration of the formulation of objectives, study design, and quantitative methods appropriate for the design. The role and use of statistical software packages.",STAT 230,,,0,0,0,0,0,0,1,0,0,0,0,0,0,0,0,1,0
COSC 303,Numerical Analysis,"COSC 303/MATH 303 (3) Numerical Analysis Numerical techniques for basic mathematical processes and their analysis. Taylor polynomials, root-finding, linear systems, eigenvalues, approximating derivatives, locating minimizers, approximating integrals, solving differential equations. Credit will be granted for only one of MATH 303 or COSC 303. [3-1-0]. Prerequisite:  All of MATH 200, MATH 221 and either (a) COSC 111 or (b) DATA 301. Equivalency: COSC 303. We will cover the following: Error, Rates of Convergence Solving 1-Variable Non-linear Equations Optimization of 1-Variable Problems Polynomial Interpolation Numerical Differentiation and Integration Monte Carlo Methods for Integration Solving Ordinary Differential Equations. Solving Linear Systems - Direct Methods. Solving Linear Systems - Iterative Methods.","ALL of MATH 200, MATH 221 and either COSC 111 or DATA 301",,MATH 303,0,0,0,0,0,1,0,0,0,0,0,0,0,0,1,0,0
COSC 322,Introduction to Artificial Intelligence,"COSC 322 (3) Introduction to Artificial Intelligence AI and intelligent agents; state space search; game playing agents; logic and knowledge-based agents; constraint programming; planning; reasoning and decision making under uncertainty; machine learning; natural language understanding. Credit will be granted for only one of COSC 322 or COSC 522. [3-2-0] Prerequisite: All of COSC 221, COSC 222. Objectives This course introduces students to the theoretical aspects and programming techniques for building artificial intelligence systems, i.e., software agents that act ""rationally"" based on available information and computing resources. We will be focusing on search-based agents, logic-based agents, agents that make decisions under uncertain environment, and agents that learn from observations. Upon successful completion of this course, students are expected to (1) obtain a thorough understanding about the fundamental problems and basic techniques in artificial intelligence; (2) acquire significant AI programming skills; and (3) have the ability to apply the discussed techniques in practice. Topics to be covered include (but not limited to) heuristic state-space search; adversarial search and game playing; constraint programming; logic inferences, knowledge representation, and automatic planning; and basics of probabilistic reasoning and machine learning.","ALL of COSC 221, COSC 222",,,0,0,0,0,0,1,0,0,0,0,0,0,0,0,1,0,0
COSC 329,,,,,,0,0,0,0,0,1,0,0,0,0,0,0,0,0,1,0,0
COSC 344,Image Processing and Applications,"Fundamental theoretical and practical concepts for processing and analyzing real-world digital images and videos, image enhancement and filtering, frequency domain and other transform analysis, morphological image operations, image segmentation, and object recognition. Credit will be granted for only one of COSC 344, COSC 435, or COSC 445.",COSC 222 and MATH 200 and MATH 221,,,0,0,0,0,0,1,0,0,0,0,0,0,0,0,1,0,0
COSC 407,Introduction to Parallel Computing,"COSC 407 (3) Introduction to Parallel Computing Design and implementation of parallel programs including theoretical computer models, parallel architectures (distributed, multicore, GPU), and standard parallel libraries. Credit will be granted for only one of COSC 407 or COSC 507. [3-2-0] Prerequisite: Either (a) COSC 111 or (b) APSC 177. Third-year standing is required. Specific description: The course will provide 3rd and 4th year students with an introduction to parallel computing. Upon completion of the course students will be able to understand parallel computing architectures and their limitations, create and implement parallel programs using various standard libraries, explain the limitation of the IEEE 754 floating point model, determine whether an undesirable output is due to floating point errors, and write parallel code. Topics include, Introduction to the course, Intro to C (basics, arrays, functions), Intro to C (pointers, struct, directives), Basic Concepts of Parallelism, OpenMP (A): Intro, OpenMP (B, C): Mutual Exclusion, Reduction, Sync, OpenMP (D): Work Sharing 1, OpenMP (E): Work Sharing 2, OpenMP (F): Example Applications, OpenMP (G, H): Speed/Efficiency, Misc, CUDA (A) : Introduction, CUDA(B,C): Programming model, Threads Organization, CUDA (D): Memories and Performance, CUDA (E,F): Thread Sync, Best Practices, CUDA: Practice Questions, Distributed Memory Concurrency (tentative – maybe discussed after Java Concurrency), Floating Point (tentative), Java Concurrency and Semaphores (tentative)",third-year standing and COSC 111,,,0,0,0,0,0,1,0,0,0,0,0,0,0,0,0,1,0
COSC 421,Network Science,"Graphs and complex networks in scientific research. Probabilistic and statistical models. Structures, patterns, and behaviors in networks. Algorithmic and statistical methods (online/mobile), social networks, and social media platforms. Social influence, information diffusion, and viral marketing. Sentiment analysis and opinion mining. Data privacy. Search engines and recommendation systems. Credit will be granted for only one of COSC 421, COSC 521, DATA 421 or DATA 521. 4. OBJECTIVES: Network science, an emerging field of scientific research, studies the structural properties and the dynamic behavior of (large-scale) complex networks. Due to the sheer size and the inherent complexity of these networks, techniques and methodologies from a variety of disciplines, including Computer science, Mathematics, Statistics, Physics, Sociology, need to be used in order to understand the patterns. This course introduces visualization and fundamental quantitative models, graph theoretic concepts, and algorithmic techniques for network analysis. Selected applications of these techniques will be included. EXPECTED OUTCOMES: Upon successful completion of this course, students are expected to demonstrate the ability to: (a) Understand the basic mathematical principles and analytic foundations of network science (b) Have a knowledge of quantitative approach to understand small and large-scale networks, (c) Use the R software for the analysis and visualization of network data. TOPICS and WEEKLY SCHEDULE: Weeks 1-2 (Jan 6– 17). Introduction; types of networks: social networks, information networks, technological networks, biological networks, affiliation networks; network data collection methods. Labs start in the second week with introduction to R and igraph library. Weeks 3-5 (Jan 20– Feb 7) Mathematical and graph-theoretic concepts: directed graphs, the adjacency matrix, acyclic directed networks, bipartite graphs, trees, degree, paths, geodesic paths. Weeks 6-9 (Feb 10 – Mar 6) Structural Characteristics and Measures of Networks: Degree centrality, eigenvalue centrality, Katz centrality, page rank, hubs and authorities, closeness centrality, betweenness centrality, cliques and components, clustering coefficient, local clustering, reciprocity, signed networks, similarity and correlation, Computer algorithms implementation in R. Weeks 10-11 (Mar 9 – Mar 20) Large-scale structure: Components, Small-world effects, Degree distributions, Power laws and scale-free networks, Community detection algorithms. Week 12-13 (Mar 23 – April 3) Network Models: Random graphs, Preferential attachment, BarabásiAlbert model, Simulation of network formation using these models.",STAT 230,,,0,0,0,0,0,1,0,0,0,0,0,0,0,0,0,1,0
MATH 303,Numerical Analysis,"COSC 303/MATH 303 (3) Numerical Analysis Numerical techniques for basic mathematical processes and their analysis. Taylor polynomials, root-finding, linear systems, eigenvalues, approximating derivatives, locating minimizers, approximating integrals, solving differential equations. Credit will be granted for only one of MATH 303 or COSC 303. [3-1-0]. Prerequisite:  All of MATH 200, MATH 221 and either (a) COSC 111 or (b) DATA 301. Equivalency: COSC 303. We will cover the following: Error, Rates of Convergence Solving 1-Variable Non-linear Equations Optimization of 1-Variable Problems Polynomial Interpolation Numerical Differentiation and Integration Monte Carlo Methods for Integration Solving Ordinary Differential Equations. Solving Linear Systems - Direct Methods. Solving Linear Systems - Iterative Methods.","All of MATH 200, MATH 221 and either COSC 11 or DATA 301",,COSC 303,0,0,1,0,0,0,0,0,0,0,0,0,0,0,1,0,0
MATH 307,Applied Linear Algebra,"Dependence/independence, bases and orthogonality; linear transformations from Rn to Rm; change of basis; triangularization; quadratic forms in variables.",MATH 221,,,0,0,1,0,0,0,0,0,0,0,0,0,0,0,1,0,0
MATH 409,Mathematics of Financial Derivatives,"Pricing theory of financial derivative securities. Options and markets, present and future values, price movement modeled by Brownian motion, Ito's formula, parbolic partial differential equations, Black-Scholes model. Prices of European options as solutions of initial/boundary value problems for heat equations, American options, free boundary problems.","All of MATH 221, MATH 319 and one of MATH 302, STAT 303",,,0,0,1,0,0,0,0,0,0,0,0,0,0,0,0,1,0
PHYS 420,Data and Image Processing,"Calendar Course Description PHYS 420 (3) Data and Image Processing Introduction to digital signal and image processing. Correlation, convolution, Fourier transforms, digital filtering, model of image formation and degradation, image filtering in the spatial and Fourier domain, deconvolution, multivariate analysis. [3-0-0]. Prerequisite: All of MATH 225, MATH 317 and 3 credits in 200-level Physics. Topics include Intro Matlab; Systems and sampling; Correlation; Time Series; Fourier Theory I; Fourier Theory II; Fourier Theory III; Filtering I; Filtering II; Filtering III; Filtering IV; Image processing I; Image processing II; Multivariate analysis I; Multivariate analysis II.","All of MATH 225, MATH 317 and 3 credits in 200-level Physics",,,0,0,0,0,1,0,0,0,0,0,0,0,0,0,0,1,0
DATA 405,Stochastic Modelling and Simulation,"COSC 405 (3) Modelling and Simulation Numeric dynamic systems models and emphasis on discrete stochastic systems. State description of models, common model components, entities. Common simulation language. Simulation using algebraic languages. Simulation methodology: data collection, model design, output analysis, optimization, validation. Elements of queuing theory, relationship to simulation. Applications to computer systems models. Credit will be granted for only one of COSC 405, DATA 405, COSC 505, or DATA 505. [3-2-0] Course Overview, Content and Objectives This course will provide an overview of statistical modelling and simulation techniques to students whose background is primarily in computer science and for those students who are studying data science. The course will begin with a review of the R Language for statistical and graphical programming. Course topics will include Monte Carlo simulation, including pseudorandom number generation and testing, simulation of discrete state stochastic processes as well as linear and nonlinear time series, elements of numerical linear algebra, and optimization. Objectives of the course are: to demonstrate how Monte Carlo simulation can be used to create realistic data scenarios; to demonstrate how digital computers can generate apparently random output; to demonstrate how simulation models can be used to assess the level of uncertainty in estimates and predictions, based on data. Learning Outcomes. After completing this course, students will be able to: construct functions and graphs using the R Language; construct and test basic pseudorandom number generators; simulate realistic data having a variety of dependence structures; assess the adequacy of various statistical models, graphically and through simulation; solve linear and quadratic programming problems.",STAT 230,,,1,0,0,0,0,0,0,0,0,0,0,0,0,0,0,1,0
DATA 407,Sampling and Design,"Planning/practice of data collection. Pros/cons of both observational and experimental data. Survey samples: random sampling; bias and variance; unequal probability sampling; systematic, multistage, and stratified sampling; ratio and regression estimators. Experimental design: simple one-way comparisons; designs with randomization restrictions including blocking, split-plots, nested and repeated measures designs. Credit will be granted for only one of DATA 407 or STAT 507.",STAT 230,,,1,0,0,0,0,0,0,0,0,0,0,0,0,0,0,1,0
DATA 410,Regression and Generalized Linear Models,"Regression, linear models, generalized linear models, additive models, generalized additive models, mixed models, theory and numerical performance.","All of MATH 221, STAT 303, DATA 311",,,1,0,0,0,0,0,0,0,0,0,0,0,0,0,0,1,0
DATA 310,Applied Regression Analysis,"Theory and application of simple and multiple linear regression models, estimation, inference (confidence intervals, prediction intervals and hypothesis testing), polynomial regression, ANOVA and ANCOVA, variable selection, model adequacy and residual diagnostics. 4. COURSE OBJECTIVES and EXPECTATIONS To introduce the widely used method of regression analysis, including the mathematical and statistical theory. To demonstrate the breadth of the scope of regression methodology applications, real datasets from various fields will be used as examples and in the exercises. This will involve use of statistical software in the lab to provide experience in drawing conclusions from calculated results. A substantial part of this course will involve a research project on the analysis of a large and realistic dataset. 5. CALENDAR DESCRIPTION Theory and application of regression analysis, including residual analysis, diagnostics, transformations, model selection and checking, weighted least squares, and nonlinear models. Additional topics may include inverse, robust, ridge, and logistic regression. [3-1-0] Prerequisite: STAT 230 and MATH 221. 8. COURSE SYLLABUS & WEEKLY SCHEDULE Weeks 1-3 Sept 6– 23: Chapters 1 & 2 Introduction and Simple Linear Regression Weeks 4-6 Sept 26 – Oct 14: Chapters 3 & 4 Review of Matrix Algebra and Multiple Linear Regression. Skip sections 3.3, 3.4 and 3.5. Weeks 7-9 Oct 17 – Nov 4: Chapters 5 & 6 Model Specification and Checking Weeks 10-11 Nov 7 – 18: Chapter 7 Model Selection Week 12 Nov 21 – 25: Chapter 9 Nonlinear Regression Week 13 Nov 28 – Dec 2: Research Project Presentations",STAT 230 and MATH 221,,,1,0,0,0,0,0,0,0,0,0,0,0,0,0,1,0,0
DATA 315,Applied Time Series and Forecasting,"Trends, stationary and nonstationary time series models, forecasting, seasonal models.",STAT 230,,,1,0,0,0,0,0,0,0,0,0,0,0,0,0,1,0,0
MATH 319,Introduction to Partial Differential Equations,"Methods of separation of variable, Fourier series, heat, wave and Laplace's equations, boundary value problems, eigenfunction expansions, and Sturm-Liouville problems."," All of MATH 200, MATH 225",,,0,0,1,0,0,0,0,0,0,0,0,0,0,0,1,0,0
MATH 225,Introduction to Differential Equations,"First-order equations, initial value problems, existence and uniqueness theorems, second-order linear equations, superposition of solutions, independence, general solutions, non-homogeneous equations, phaseplane analysis, numerical methods, matrix methods for linear systems, and applications of differential equations to the physical, biological, and social sciences.",MATH 101,MATH 221,,0,0,1,0,0,0,0,0,0,0,0,0,0,1,0,0,0
MATH 317,Calculus IV,"Parametrizations, inverse and implicit functions, integrals with respect to length and area; grad, div, and curl, and theorems of Green, Gauss, and Stokes.",MATH 200,,,0,0,1,0,0,0,0,0,0,0,0,0,0,0,1,0,0
ECON 102,Principles of Macroeconomics,"Elements of theory and Canadian policy and institutions concerning the economics of growth and business cycles, national income accounting, interest and exchange rates, money and banking, the balance of trade.",,,,0,0,0,0,0,0,0,0,0,0,1,0,1,0,0,0,0
APSC 177,Engineering Computation and Instrumentation,"Computer systems, software development, operating systems, compilers, programming in a high-level language, selection and loop structures, functions, arrays, pointers, files, data acquisition, solving engineering problems with computer programs.",,,,0,0,0,0,0,0,0,0,1,0,0,0,1,0,0,0,0
BIOL 202,Introduction to Biostatistics,"Data analysis methods for biologists including sampling and experimental design, visualizing and describing data, probability, hypothesis testing, comparisons of proportions and means, correlation and regression analysis, analysis of variance, non-parametric, permutation-based tests, and the central roles that statistical analyses and reproducibility play in scientific research. R and RMarkdown are used to visualize and analyze data, and to communicate findings using literate programming.",MATH 100,,,0,0,0,0,0,0,0,0,0,0,0,1,0,1,0,0,0
PSYO 373,Advanced Research Methods and Statistics,"Addresses selected issues on the validity and quality of research, complex research designs, and associated statistical analyses. Students will gain additional experience in the use of standard statistical computer programs.",PSYO 372,,,0,0,0,0,0,0,0,0,0,1,0,0,0,0,1,0,0
PSYO 372,Research Methods and Statistics,"Examination of sophisticated research designs and associated statistical methods. Direct research experience involving design, collection, and analysis of data in a formal research report; familiarity with use of computer programs to analyze research results.",PSYO 270 and PSYO 271,,,0,0,0,0,0,0,0,0,0,1,0,0,0,0,1,0,0
PSYO 270,Introduction to Research Methods and Design,Introduction to the procedures and difficulties in the design and critical evaluation of research in experimental psychology. Various research designs and basic statistics. A required course for students majoring in Psychology.,PSYO 111 and PSYO 121,,,0,0,0,0,0,0,0,0,0,1,0,0,0,1,0,0,0
PSYO 271,Introduction to Data Analysis,"Introduction to behavioural data analysis focusing on the use of inferential statistics in psychology and the conceptual interpretation of data as related to basic experimental designs (laboratory, field research methods). A required course for students majoring in Psychology. STAT 121 is recommended.",PSYO 270,,,0,0,0,0,0,0,0,0,0,1,0,0,0,1,0,0,0
PSYO 111,Introduction to Psychology: Basic Processes,"Survey of topics in psychology which relate to basic processes. Methods and statistics, the nervous system and physiological processes, sensation and perception, learning, cognition and memory.",,,,0,0,0,0,0,0,0,0,0,1,0,0,1,0,0,0,0
PSYO 121,Introduction to Psychology: Personal Functioning,"Survey of topics in psychology which relate to personal functioning. Methods and statistics, motivation and emotion, life span development, social processes, personality, abnormal behaviour, and psychotherapy.",PSYO 111,,,0,0,0,0,0,0,0,0,0,1,0,0,1,0,0,0,0
APSC 254,Instrumentation and Data Analysis,"Data acquisition, sensors, instrumentation, measurement techniques and their limitations, experimental design, and data analysis; statistics, basic probability; application of statistics to data analysis.",APSC 173 and APSC 178,,,0,0,0,0,0,0,0,0,1,0,0,0,0,1,0,0,0
APSC 173,Engineering Analysis II,"Integrals and transcendental functions, techniques of integration, applications of integration, polar coordinates, infinite sequences and series, vectors and the geometry of space, and partial derivatives.",APSC 172,,,0,0,0,0,0,0,0,0,1,0,0,0,1,0,0,0,0
APSC 172,Engineering Analysis I,"Functions, limits, differentiation, applications of derivatives, integration, applications of definite integrals.",,,,0,0,0,0,0,0,0,0,1,0,0,0,1,0,0,0,0
APSC 178,"Electricity, Magnetism, and Waves","Electric fields and forces, electric potential, capacitance, DC circuits, magnetic fields and forces, Faraday's law, inductance, waves, light, and optics.",APSC 172,APSC 173,,0,0,0,0,0,0,0,0,1,0,0,0,1,0,0,0,0
MATH 220,Mathematical Proof,"Sets and functions; induction; cardinality; properties of the real numbers; sequences, series, and limits. Logic, structure, style, and clarity of proofs emphasized throughout.",MATH 101,,,0,0,1,0,0,0,0,0,0,0,0,0,0,1,0,0,0
